Search String,Search Engine,Link,Title,Time stamp,Media name
Tata Lawsuits,google,https://www.business-standard.com/technology/tech-news/it-services-focus-on-building-ip-and-platforms-may-trigger-more-lawsuits-124100901370_1.html,IT services' focus on building IP and platforms may trigger more lawsuits,10 Oct 2024,Business Standard
Tata Lawsuits,google,https://indianexpress.com/article/business/ratan-tata-singur-mistry-tata-tapes-wadia-controversies-9613283/,"From Singur, Mistry, Tata Tapes to Wadia: 5 controversies during Ratan Tata’s tenure",11 Oct 2024,The Indian Express
Tata Lawsuits,google,https://www.cardekho.com/india-car-news/mahindra-responds-to-indigos-lawsuit-for-using-the-6e-term-in-be-6e-branding-33603.htm,IndiGo Files Trademark Infringement Claim Against Mahindra For ‘6e’ Branding; Automaker Responds,3 Dec 2024,CarDekho
Tata Lawsuits,google,https://timesofindia.indiatimes.com/technology/tech-news/more-than-20-fired-americans-workers-of-tcs-have-sued-the-company-what-are-the-allegations-and-it-giants-response/articleshow/108906267.cms,"More than 20 fired American workers have sued TCS, why and IT giant's response",31 Mar 2024,Times of India
Tata Lawsuits,google,https://news.bloomberglaw.com/daily-labor-report/tata-fired-white-us-workers-in-favor-of-visa-holders-suit-says,"Tata Fired White US Workers in Favor of Visa Holders, Suit Says",9 Apr 2024,Bloomberg Law News
Tata Lawsuits,google,https://www.wsj.com/business/fired-americans-say-indian-firm-gave-their-jobs-to-h-1b-visa-holders-6da7cf26,Exclusive | Fired Americans Say Indian Firm Gave Their Jobs to H-1B Visa Holders,29 Mar 2024,WSJ
Tata Lawsuits,google,https://m.economictimes.com/tech/information-tech/tcs-fined-rs-1600-crore-by-us-court-in-dxc-case/articleshow/111013835.cms,"TCS fined Rs 1,600 crore by US court for misappropriation of trade secrets",15 Jun 2024,The Economic Times
Tata Lawsuits,google,https://www.outlookbusiness.com/news/tcs-asked-to-pay-210-million-fine-to-dxc-technology-in-trade-secrets-row,TCS Asked To Pay $210 Million Fine To DXC Technology In Trade Secrets Row,27 Nov 2023,Outlook Business
Tata Lawsuits,google,https://www.thestar.com.my/tech/tech-news/2025/01/02/ibm-globalfoundries-settle-lawsuits-over-contract-trade-secrets,"IBM, GlobalFoundries settle lawsuits over contract, trade secrets",1 month ago,The Star
Tata Lawsuits,google,https://www.dutchnews.nl/2024/05/third-court-case-launched-against-tata-steel-calls-for-closure/,"Third court case launched against Tata Steel, calls for closure",27 May 2024,DutchNews.nl
Tata Lawsuits,bing,/news/search?q=site%3awww.businessinsider.in&FORM=NWBCLM,"Tata Consultancy Services, India’s second most valuable company by market cap after Reliance Industries, just got hit with its second lawsuit in five years for alleged theft of “trade secrets”.",5y,Business Insider India5y
Tata Lawsuits,bing,/news/search?q=site%3awww.hindustantimes.com&FORM=NWBCLM,"Dabur had launched a product called Schezwan 2024, which sparked the legal conflict, since Tata's Capital Foods owned the Schezwan Chutney trademark The Tata Group's Capital Foods has sued Dabur ...",18d,Hindustan Times18d
Tata Lawsuits,bing,/news/search?q=site%3awww.businessinsider.in&FORM=NWBCLM,"A US jury has ruled in favor of India’s IT outsourcing giant, Tata Consultancy Consultancy Services Ltd (TCS), in a lawsuit alleging the company had followed discriminatory hiring practices ...",6y,Business Insider India6y
Tata Lawsuits,bing,https://www.msn.com/en-in/news/other/here-s-why-nykaa-is-suing-tata-cliq-ceo-gopal-asthana/ar-AA1q29B2?ocid=BingNewsVerp,"The beauty and fashion e-commerce platform, Nykaa has filed a lawsuit against its former chief business officer, Aakash Asthana, who is now the chief executive officer of Tata Cliq Luxury.",5mon,Hosted on MSN5mon
Tata Lawsuits,bing,https://www.newsbytesapp.com/news/business/tata-acquires-60-stake-in-pegatron-india-apple-s-assembly-partner/story,Tata Electronics Private Limited (TEPL) has successfully acquired a 60% controlling stake in the Pegatron Technology India ...,10d,newsbytesapp.com10d
Tata Lawsuits,yahoo,https://r.search.yahoo.com/_ylt=AwrO6Pt4y6Bn5ism7C7QtDMD;_ylu=Y29sbwNncTEEcG9zAzEEdnRpZAMEc2VjA3Ny/RV=2/RE=1738619896/RO=10/RU=https%3a%2f%2ffinance.yahoo.com%2fnews%2findias-tcs-125-million-hit-115115682.html%3ffr%3dsycsrp_catchall/RK=2/RS=N5s1MTCwTigv9oqTZNQ5eF5BaMw-,India's TCS to take $125 million hit to Q3 earnings over US lawsuit,1 year ago ·,Reuters·  via Yahoo Finance
Tata Lawsuits,yahoo,https://r.search.yahoo.com/_ylt=AwrO6Pt4y6Bn5ism7i7QtDMD;_ylu=Y29sbwNncTEEcG9zAzIEdnRpZAMEc2VjA3Ny/RV=2/RE=1738619896/RO=10/RU=https%3a%2f%2fwww.yahoo.com%2fnews%2fmama-tata-influencer-candice-miller-224820000.html%3ffr%3dsycsrp_catchall/RK=2/RS=VC4ArfnChCy6d8.yK10C7MgU2vA-,Mama & Tata Influencer Candice Miller Saddled with Husband’s $33.6 Million Debt...,1 month ago ·,People·  via Yahoo News
Tata Lawsuits,yahoo,https://r.search.yahoo.com/_ylt=AwrO6Pt4y6Bn5ism8C7QtDMD;_ylu=Y29sbwNncTEEcG9zAzMEdnRpZAMEc2VjA3Ny/RV=2/RE=1738619896/RO=10/RU=https%3a%2f%2fwww.yahoo.com%2fnews%2freal-estate-mogul-husband-mama-191725327.html%3ffr%3dsycsrp_catchall/RK=2/RS=0363.rLq1eMDWaXpiBERb_Jd5ZU-,"Real estate mogul, husband of Mama + Tata influencer dead at 43",7 months ago ·,NY Post·  via Yahoo News
Tata Lawsuits,yahoo,https://r.search.yahoo.com/_ylt=AwrO6Pt4y6Bn5ism8i7QtDMD;_ylu=Y29sbwNncTEEcG9zAzQEdnRpZAMEc2VjA3Ny/RV=2/RE=1738619896/RO=10/RU=https%3a%2f%2fwww.aol.com%2fmama-tata-influencer-candice-miller-170622813.html/RK=2/RS=AWiBD_snvxH7ZYtMxmCwSgBlduE-,Mama & Tata Influencer Candice Miller Selling $15 Million Hamptons Home 1 Month...,6 months ago ·,People·  via AOL
Tata Lawsuits,yahoo,https://r.search.yahoo.com/_ylt=AwrO6Pt4y6Bn5ism9C7QtDMD;_ylu=Y29sbwNncTEEcG9zAzUEdnRpZAMEc2VjA3Ny/RV=2/RE=1738619896/RO=10/RU=https%3a%2f%2fwww.yahoo.com%2fnews%2fmama-tata-influencer-candice-miller-162003406.html%3ffr%3dsycsrp_catchall/RK=2/RS=9RkX7asPoB4kvsLqOgvYmpWrPfo-,Hundreds of Items Auctioned Off from Former Home of Mama & Tata Influencer...,1 month ago ·,People·  via Yahoo News
Tata Lawsuits,yahoo,https://r.search.yahoo.com/_ylt=AwrO6Pt4y6Bn5ism9i7QtDMD;_ylu=Y29sbwNncTEEcG9zAzYEdnRpZAMEc2VjA3Ny/RV=2/RE=1738619896/RO=10/RU=https%3a%2f%2ffinance.yahoo.com%2fnews%2ftcs-revamps-organization-structure-leverage-082432871.html%3ffr%3dsycsrp_catchall/RK=2/RS=CPwKhl1K_0fVSn54ghVdA1VNf8s-,TCS Revamps Organization Structure to Leverage Domain Knowledge,2 years ago ·,Bloomberg·  via Yahoo Finance
Tata Lawsuits,yahoo,https://r.search.yahoo.com/_ylt=AwrO6Pt4y6Bn5ism.C7QtDMD;_ylu=Y29sbwNncTEEcG9zAzcEdnRpZAMEc2VjA3Ny/RV=2/RE=1738619896/RO=10/RU=https%3a%2f%2fwww.yahoo.com%2ftech%2feverything-apple-says-wrong-doj-180017657.html/RK=2/RS=g8KDy_1Q95RdBeZvgULCXWRpVNk-,Everything Apple says is wrong about the DOJ’s iPhone lawsuit,10 months ago ·,Digital Trends·  via Yahoo News
Tata Lawsuits,yahoo,https://r.search.yahoo.com/_ylt=AwrO6Pt4y6Bn5ism.i7QtDMD;_ylu=Y29sbwNncTEEcG9zAzgEdnRpZAMEc2VjA3Ny/RV=2/RE=1738619896/RO=10/RU=https%3a%2f%2fwww.yahoo.com%2fnews%2finfluencer-candice-miller-selling-personal-181930540.html%3ffr%3dsycsrp_catchall/RK=2/RS=2rF9wy30mOBSiRzvZJWU2lKVIYU-,Influencer Candice Miller selling personal items after late husband amassed...,1 month ago ·,The Independent·  via Yahoo News
Tata Lawsuits,yahoo,https://r.search.yahoo.com/_ylt=AwrO6Pt4y6Bn5ism_C7QtDMD;_ylu=Y29sbwNncTEEcG9zAzkEdnRpZAMEc2VjA3Ny/RV=2/RE=1738619896/RO=10/RU=https%3a%2f%2ffinance.yahoo.com%2fnews%2fchief-executives-air-india-akasa-075037899.html%3ffr%3dsycsrp_catchall/RK=2/RS=LKh4yjYqxLfn19tUUJBd38ynUNk-,"Chief executives of Air India, Akasa joust over poaching of pilots",1 year ago ·,Reuters·  via Yahoo Finance
Tata Lawsuits,yahoo,https://r.search.yahoo.com/_ylt=AwrO6Pt4y6Bn5ism_i7QtDMD;_ylu=Y29sbwNncTEEcG9zAzEwBHZ0aWQDBHNlYwNzcg--/RV=2/RE=1738619896/RO=10/RU=https%3a%2f%2fsports.yahoo.com%2fmessi-still-suarez-may-rest-214315586.html%3ffr%3dsycsrp_catchall/RK=2/RS=yEDqHxSg6by47YrE62wn9Uu0vpQ-,"Messi still out, Suarez may rest for Inter Miami vs. Tigres Leagues Cup game in...",6 months ago ·,Miami Herald·  via Yahoo Sports
Tata merger,google,https://the-ken.com/story/tata-tech-just-merge-with-tata-elxsi/,"Tata Tech, just merge with Tata Elxsi",3 days ago,The Ken
Tata merger,google,https://www.business-standard.com/companies/news/tata-capital-tata-motors-finance-merger-receives-rbi-s-approval-124101401020_1.html,"Tata Capital, Tata Motors Finance merger receives RBI's approval",14 Oct 2024,Business Standard
Tata merger,google,https://m.economictimes.com/markets/stocks/news/vedanta-ultratech-tata-motors-among-8-mergers-and-demergers-to-track/corporate-radar/slideshow/117677020.cms,"Vedanta, UltraTech, Tata Motors among 8 mergers and demergers to track",5 days ago,The Economic Times
Tata merger,google,https://www.cnbctv18.com/business/aviation/tata-sons-singapore-airlines-celebrate-vistaras-merger-with-air-india-19511222.htm,Tata Sons & Singapore Airlines celebrate Vistara’s merger with Air India,18 Nov 2024,CNBC TV18
Tata merger,google,https://upstox.com/news/business-news/latest-updates/explained-why-tata-capital-s-potential-ipo-impacting-tata-group-stocks-how-are-the-companies-linked/article-136880/,How are Tata Group companies linked? Why Tata Capital’s IPO could unlock value across conglomerate,1 month ago,Upstox
Tata merger,google,https://www.thehindubusinessline.com/companies/merger-with-tata-motors-finance-will-broaden-tata-capitals-product-portfolio-says-fitch/article68327326.ece,"Merger with Tata Motors Finance will broaden Tata Capital’s product portfolio, says Fitch",24 Jun 2024,The Hindu BusinessLine
Tata merger,google,https://skift.com/2024/09/17/air-india-vistara-merger-strategic-win-or-tatas-gamble/,Air India-Vistara Merger: Strategic Win or Tata’s Gamble?,17 Sept 2024,Skift
Tata merger,google,https://www.businesstoday.in/latest/corporate/story/bharti-airtel-tata-play-entity-may-not-have-representatives-from-tata-group-on-board-459793-2025-01-07,Bharti Airtel-Tata Play entity may not have representatives from Tata Group on board,4 weeks ago,Business Today
Tata merger,google,https://www.livemint.com/companies/news/air-india-vistara-merger-completes-singapore-airlines-to-invest-rs-3-194-5-crore-in-indias-largest-international-carti-11731413602450.html,Air India-Vistara merger completed: Tata-group airline becomes India’s largest international carrier; here’s how,12 Nov 2024,mint
Tata merger,google,https://www.livelaw.in/consumer-cases/cci-approves-proposed-merger-of-tata-motors-finance-limited-with-tata-capital-limited-269464,CCI Approves Proposed Merger Of Tata Motors Finance Limited With Tata Capital Limited,12 Sept 2024,Live Law
Tata merger,bing,https://www.business-standard.com/markets/ipo/tata-capital-sets-stage-for-ipo-with-articles-of-association-update-125013101256_1.html,"The company said its current shareholder base is around 29,000 and in order to avoid a situation where its shareholder base ...",2d,2d
Tata merger,bing,https://www.msn.com/en-in/money/news/tata-sons-seeks-cci-clearance-to-acquire-additional-10-pc-stake-in-tata-play/ar-AA1xNk2j?ocid=BingNewsVerp,"After the completion of the deal, Tata Sons will have a 70% holding in the entertainment content distribution platform.",9d,Press Trust of India on MSN9d
Tata merger,bing,https://www.business-standard.com/companies/news/tata-electronics-buys-60-stake-in-pegatron-s-india-arm-for-iphone-plant-125012400770_1.html,The announcement is coming after the Competition Commission of India (CCI) gave an approval to Tata Electronics to acquire ...,10d,10d
Tata merger,bing,https://www.msn.com/en-in/money/news/modi-govt-said-to-ditch-privatisation-plans-pour-billions-in-state-run-firms/ar-AA1xVLwK?ocid=BingNewsVerp,"Modi government shifts focus from privatisation to reviving state-run firms with billions in investments, facing opposition.",6d,6don MSN
Tata merger,bing,/news/search?q=site%3atrak.in&FORM=NWBCLM,“The Board of Directors of Tata Motors Ltd has approved a Composite Scheme of Arrangement involving the demerger of its CV business undertaking and the merger of Tata Motors Passenger Vehicles ...,21d,Trak.in - India Business Blog21d
Tata merger,bing,https://www.msn.com/en-in/news/India/3-years-of-air-india-under-the-tatas-the-hits-and-misses-of-maharajah/ar-AA1xSeW2?ocid=BingNewsVerp,"The group started with four airlines, one each which it started in collaboration with AirAsia Bhd and Singapore Airlines and ...",7d,7don MSN
Tata merger,bing,/news/search?q=site%3awww.thehindubusinessline.com&FORM=NWBCLM,Tata Steel Limited has been slapped with a penalty of ₹1.46 crore by Maharashtra’s Collector of Stamps for delayed filing of stamp duty application related to its merger with The Tinplate ...,21d,Business Line21d
Tata merger,bing,https://auto.economictimes.indiatimes.com/videos/tata-motors-new-energy-products-a-new-scv-to-attract-3w-customers-demerger-rationale-and-more/117359690,"A heavy duty battery electric truck, and a flexfuel small commercial vehicle are among 14 commercial vehicle showcases by ...",15d,ET Auto15d
Tata merger,bing,https://www.firstpost.com/sports/d-gukesh-tata-steel-chess-2025-wimbledon-of-chess-explained-13853301.html,"The Tata Steel Chess, which will be Gukesh Dommaraju’s first event since being crowned world champion in Singapore, gets ...",18d,18d
Tata merger,yahoo,https://r.search.yahoo.com/_ylt=AwrO6Pt6y6Bnq5Em1AzQtDMD;_ylu=Y29sbwNncTEEcG9zAzEEdnRpZAMEc2VjA3Ny/RV=2/RE=1738619898/RO=10/RU=https%3a%2f%2ffinance.yahoo.com%2fnews%2fratan-tata-austere-indian-tycoon-150523359.html%3ffr%3dsycsrp_catchall/RK=2/RS=RagmfwakFoW_10zT5QN1P_TraYU-,"Ratan Tata, austere Indian tycoon who bought Jaguar Land Rover but lost a...",4 months ago ·,The Telegraph·  via Yahoo Finance
Tata merger,yahoo,https://r.search.yahoo.com/_ylt=AwrO6Pt6y6Bnq5Em1gzQtDMD;_ylu=Y29sbwNncTEEcG9zAzIEdnRpZAMEc2VjA3Ny/RV=2/RE=1738619898/RO=10/RU=https%3a%2f%2ffinance.yahoo.com%2fnews%2fdisney-strikes-deal-sell-stake-161500120.html%3ffr%3dsycsrp_catchall/RK=2/RS=uoSGEDlGUoEVI50mK7I4UOmPj2c-,"Disney strikes deal to sell stake in India's Tata Play, Bloomberg News reports",8 months ago ·,Reuters·  via Yahoo Finance
Tata merger,yahoo,https://r.search.yahoo.com/_ylt=AwrO6Pt6y6Bnq5Em2AzQtDMD;_ylu=Y29sbwNncTEEcG9zAzMEdnRpZAMEc2VjA3Ny/RV=2/RE=1738619898/RO=10/RU=https%3a%2f%2ffinance.yahoo.com%2fnews%2findias-tata-sons-raises-stake-034639433.html%3ffr%3dsycsrp_catchall/RK=2/RS=WC6l_uSq77tpD.87474tuE5o710-,"India's Tata Sons raises stake in Tata Play, Temasek exits, Economic Times...",9 months ago ·,Reuters·  via Yahoo Finance
Tata merger,yahoo,https://r.search.yahoo.com/_ylt=AwrO6Pt6y6Bnq5Em2gzQtDMD;_ylu=Y29sbwNncTEEcG9zAzQEdnRpZAMEc2VjA3Ny/RV=2/RE=1738619898/RO=10/RU=https%3a%2f%2ffinance.yahoo.com%2fnews%2fdisney-said-sell-stake-tata-022649109.html%3ffr%3dsycsrp_catchall/RK=2/RS=pwI2o2BG.uFvr2z7_LRF.FiKO3Y-,Disney Is Said to Sell Stake in Tata’s India TV Platform,8 months ago ·,Bloomberg·  via Yahoo Finance
Tata merger,yahoo,https://r.search.yahoo.com/_ylt=AwrO6Pt6y6Bnq5Em3AzQtDMD;_ylu=Y29sbwNncTEEcG9zAzUEdnRpZAMEc2VjA3Ny/RV=2/RE=1738619898/RO=10/RU=https%3a%2f%2ffinance.yahoo.com%2fnews%2fair-india-ceo-meets-india-112842687.html%3ffr%3dsycsrp_catchall/RK=2/RS=XusYpplxUKenJ6uqTxR28D33LMI-,Air India CEO meets India antitrust chief on pending Vistara merger -sources,2 years ago ·,Reuters·  via Yahoo Finance
Tata merger,yahoo,https://r.search.yahoo.com/_ylt=AwrO6Pt6y6Bnq5Em3gzQtDMD;_ylu=Y29sbwNncTEEcG9zAzYEdnRpZAMEc2VjA3Ny/RV=2/RE=1738619898/RO=10/RU=https%3a%2f%2ffinance.yahoo.com%2fnews%2fair-india-strives-revive-fortunes-153729188.html%3ffr%3dsycsrp_catchall/RK=2/RS=fz0IqVuL5G827H39B.ATatoN2Vg-,Air India strives to revive its fortunes with Tata money,2 years ago ·,Reuters·  via Yahoo Finance
Tata merger,yahoo,https://r.search.yahoo.com/_ylt=AwrO6Pt6y6Bnq5Em4AzQtDMD;_ylu=Y29sbwNncTEEcG9zAzcEdnRpZAMEc2VjA3Ny/RV=2/RE=1738619898/RO=10/RU=https%3a%2f%2fwww.aol.com%2fdeal-create-one-world-largest-114826582.html/RK=2/RS=ChxZGesPenrUBhHHIS_C8Z.fOaY-,Deal to create one of world’s largest airline groups gets regulator approval,5 months ago ·,The Independent US·  via AOL
Tata merger,yahoo,https://r.search.yahoo.com/_ylt=AwrO6Pt6y6Bnq5Em4gzQtDMD;_ylu=Y29sbwNncTEEcG9zAzgEdnRpZAMEc2VjA3Ny/RV=2/RE=1738619898/RO=10/RU=https%3a%2f%2ffinance.yahoo.com%2fnews%2fsingapore-airlines-gets-indias-fdi-004403487.html%3ffr%3dsycsrp_catchall/RK=2/RS=.qHxXOHYcV8s8Qu_X36af9Pcsl8-,Air India to operate Vistara flights from November as merger gets key approval,5 months ago ·,Reuters·  via Yahoo Finance
Tata merger,yahoo,https://r.search.yahoo.com/_ylt=AwrO6Pt6y6Bnq5Em4wzQtDMD;_ylu=Y29sbwNncTEEcG9zAzkEdnRpZAMEc2VjA3Ny/RV=2/RE=1738619898/RO=10/RU=https%3a%2f%2ffinance.yahoo.com%2fnews%2ftata-sons-gears-potential-ipo-060244697.html%3ffr%3dsycsrp_catchall/RK=2/RS=11i8jcLIbzEWyH6EuqnsnbVQqkU-,Tata Sons gears up for potential IPO following upper-layer NBFC classification,1 year ago ·,Investing.com·  via Yahoo Finance
Tata merger,yahoo,https://r.search.yahoo.com/_ylt=AwrO6Pt6y6Bnq5Em5QzQtDMD;_ylu=Y29sbwNncTEEcG9zAzEwBHZ0aWQDBHNlYwNzcg--/RV=2/RE=1738619898/RO=10/RU=https%3a%2f%2ffinance.yahoo.com%2fnews%2findia-antitrust-body-examining-air-042537209.html%3ffr%3dsycsrp_catchall/RK=2/RS=0KsYAHTda3wKJOEDUv261GgHHA0-,"India flags antitrust concerns with Air India, Vistara merger -sources",2 years ago ·,Reuters·  via Yahoo Finance
Tata bankruptcy,google,https://www.india.com/business/meet-indias-first-female-tennis-olympian-lady-meherbai-tata-whose-diamond-saved-tata-steel-from-bankruptcy-she-is-ratan-tatas-aunt-7367214/,"Meet India’s first female tennis Olympian whose diamond saved Tata Steel from bankruptcy, she is Ratan Tata’s",4 Nov 2024,India.Com
Tata bankruptcy,google,https://www.indiatvnews.com/business/news/ratan-tata-got-revenge-by-buying-jaguar-and-land-rover-after-facing-humiliation-by-ford-2008-deal-2024-10-10-956468,Ratan Tata got 'revenge' by buying Jaguar and Land Rover after facing 'humiliation' by Ford | INSIDE STORY,10 Oct 2024,India TV News
Tata bankruptcy,google,https://timesofindia.indiatimes.com/business/india-business/how-fords-insult-led-ratan-tata-to-buy-jaguar-land-rover/articleshow/114119073.cms,"How Ford's insult led Ratan Tata to buy Jaguar, Land Rover",10 Oct 2024,Times of India
Tata bankruptcy,google,https://www.deccanherald.com/business/how-ratan-turned-tamo-into-an-automotive-powerhouse-3227916,How Ratan turned TaMo into an automotive powerhouse,10 Oct 2024,Deccan Herald
Tata bankruptcy,google,https://www.taxscan.in/tata-steel-took-over-bhushan-steel-cestat-clarifies-appeals-are-abated-post-rp-approval-by-nclt-under-ibc-it-becomes-functus-officio/473401/,TATA Steel’s Acquisition of Bhushan Steel: CESTAT Rules Appeals Abate Post NCLT RP Approval Under IBC,1 month ago,Taxscan
Tata bankruptcy,google,https://auto.hindustantimes.com/auto/electric-vehicles/indiabound-ev-startup-fisker-files-for-bankruptcy-41718695865554.html,Once India-bound EV startup Fisker files for bankruptcy,18 Jun 2024,HT Auto
Tata bankruptcy,google,https://www.freepressjournal.in/business/tupperware-bankruptcy-netizens-reminisce-react-to-the-fallen-icon-of-kitchenware,Tupperware Bankruptcy: Netizens Reminisce & React To The Fallen Icon Of Kitchenware,19 Sept 2024,Free Press Journal
Tata bankruptcy,google,https://www.india.com/business/meet-man-ratan-tata-ousted-him-from-three-tata-firms-his-airline-went-bankrupt-still-one-of-indias-richest-with-net-worth-of-rs-44000-crores-his-son-is-ness-wadia-7470806/,"Meet man, Ratan Tata ousted him from three Tata firms, his airline went bankrupt, still one of India's riches",1 month ago,India.Com
Tata bankruptcy,google,https://www.tipranks.com/news/company-announcements/tata-health-navigates-financial-challenges-amid-bankruptcy,TATA Health Navigates Financial Challenges Amid Bankruptcy,1 month ago,TipRanks
Tata bankruptcy,google,https://www.thehindu.com/business/Industry/how-ratan-tata-bailed-out-ford-by-buying-jaguar-land-rover-despite-the-american-firm-humiliating-him-years-before/article68740015.ece,"How Ratan Tata bailed out Ford by buying Jaguar-Land Rover, despite the American firm humiliating him years before",10 Oct 2024,The Hindu
Tata bankruptcy,bing,https://www.msn.com/en-in/society-culture-and-history/history/noel-tata-scripts-history-tata-steel-becomes-first-indian-company-to-helps-india-to-achieve/ar-AA1yisZy?ocid=BingNewsVerp,"Tata Steel’s breakthrough in hydrogen-compliant pipes is yet another testament to this legacy, India closer to its clean ...",11h,11hon MSN
Tata bankruptcy,bing,https://www.msn.com/en-in/autos/news/ratan-tata-changed-the-date-of-7-companies-they-are-now-doing-super-business-these-companies-are/ar-AA1scPGS?ocid=BingNewsVerp,"Tata group bought them & transformed them in such a way, that they became global success. These businesses were on the verge ...",3mon,3monon MSN
Tata bankruptcy,bing,/news/search?q=site%3awww.dnaindia.com&FORM=NWBCLM,"She remains an inspiring figure for her contributions to women's rights and her role in shaping modern India Shivam Verma Updated : Oct 21, 2024, 04:20 PM IST Lady Meherbai Tata, the daughter-in-law ...",3mon,DNA India3mon
Tata bankruptcy,bing,/news/search?q=site%3awww.nasdaq.com&FORM=NWBCLM,"Despite these hurdles, TATA Health continues regular business operations while monitoring its financial health. TipRanks is the most comprehensive data set of sell side analysts and hedge fund ...",1mon,Nasdaq1mon
Tata bankruptcy,bing,https://www.msn.com/en-in/society-culture-and-history/general/ratan-tata-birth-anniversary-honour-the-legacy-of-a-visionary-leader/ar-AA1wC7dF?ocid=BingNewsVerp,"Under his leadership, NELCO was transformed from the brink of bankruptcy to profitability, demonstrating his talent for revitalizing struggling businesses. In 1981, Ratan Tata was appointed ...",1mon,Hosted on MSN1mon
Tata bankruptcy,yahoo,https://r.search.yahoo.com/_ylt=AwrjIcR8y6BnARUmAjPQtDMD;_ylu=Y29sbwNncTEEcG9zAzEEdnRpZAMEc2VjA3Ny/RV=2/RE=1738619900/RO=10/RU=https%3a%2f%2fwww.yahoo.com%2ftech%2ffirsts-bankruptcy-fueled-mass-resignations-101500639.html/RK=2/RS=CByJpQHlQdqc4ZoJYFzBR9JhlOk-,Go First's bankruptcy has fueled mass resignations and higher air fares,2 years ago ·,Quartz·  via Yahoo News
Tata bankruptcy,yahoo,https://r.search.yahoo.com/_ylt=AwrjIcR8y6BnARUmBDPQtDMD;_ylu=Y29sbwNncTEEcG9zAzIEdnRpZAMEc2VjA3Ny/RV=2/RE=1738619900/RO=10/RU=https%3a%2f%2ffinance.yahoo.com%2fnews%2findigo-shares-surge-smaller-rival-043606652.html%3ffr%3dsycsrp_catchall/RK=2/RS=FxqWoMvHVx5LY4S_CPOJ6fIpxS0-,"India's Go First touts owner, govt backing after bankruptcy filing",2 years ago ·,Reuters·  via Yahoo Finance
Tata bankruptcy,yahoo,https://r.search.yahoo.com/_ylt=AwrjIcR8y6BnARUmBjPQtDMD;_ylu=Y29sbwNncTEEcG9zAzMEdnRpZAMEc2VjA3Ny/RV=2/RE=1738619900/RO=10/RU=https%3a%2f%2ffinance.yahoo.com%2fnews%2findias-first-airline-files-bankruptcy-101608770.html%3ffr%3dsycsrp_catchall/RK=2/RS=g1MaD8ClyTq6g0wfnyxT8MNTGYA-,"India's Go First airline files for bankruptcy, blames Pratt & Whitney engines",2 years ago ·,Reuters·  via Yahoo Finance
Tata bankruptcy,yahoo,https://r.search.yahoo.com/_ylt=AwrjIcR8y6BnARUmCDPQtDMD;_ylu=Y29sbwNncTEEcG9zAzQEdnRpZAMEc2VjA3Ny/RV=2/RE=1738619900/RO=10/RU=https%3a%2f%2ffinance.yahoo.com%2fnews%2findia-decide-first-bankruptcy-lessors-022933369.html%3ffr%3dsycsrp_catchall/RK=2/RS=Hpi3BOwySunKJEVUCi5vMBtRZko-,"India's Go First airline gains bankruptcy protection, lessors' woes deepen",2 years ago ·,Reuters·  via Yahoo Finance
Tata bankruptcy,yahoo,https://r.search.yahoo.com/_ylt=AwrjIcR8y6BnARUmCjPQtDMD;_ylu=Y29sbwNncTEEcG9zAzUEdnRpZAMEc2VjA3Ny/RV=2/RE=1738619900/RO=10/RU=https%3a%2f%2ffinance.yahoo.com%2fnews%2fjinkosolar-holding-co-jks-too-233747157.html%3ffr%3dsycsrp_catchall/RK=2/RS=tTEhxscbloStqfgLWf39ZfCmBr4-,Is JinkoSolar Holding Co (JKS) Too Good to Be True? A Comprehensive Analysis of...,1 year ago ·,GuruFocus.com·  via Yahoo Finance
Tata bankruptcy,yahoo,https://r.search.yahoo.com/_ylt=AwrjIcR8y6BnARUmDDPQtDMD;_ylu=Y29sbwNncTEEcG9zAzYEdnRpZAMEc2VjA3Ny/RV=2/RE=1738619900/RO=10/RU=https%3a%2f%2ffinance.yahoo.com%2fnews%2fviasat-vsat-too-good-true-234134524.html%3ffr%3dsycsrp_catchall/RK=2/RS=GtwyzgdsM27HRgrUJv7f9tDuoNU-,Is Viasat (VSAT) Too Good to Be True? A Comprehensive Analysis of a Potential...,1 year ago ·,GuruFocus.com·  via Yahoo Finance
Tata bankruptcy,yahoo,https://r.search.yahoo.com/_ylt=AwrjIcR8y6BnARUmDjPQtDMD;_ylu=Y29sbwNncTEEcG9zAzcEdnRpZAMEc2VjA3Ny/RV=2/RE=1738619900/RO=10/RU=https%3a%2f%2fwww.yahoo.com%2fentertainment%2finfluencer-selling-hamptons-estate-moving-161611211.html%3ffr%3dsycsrp_catchall/RK=2/RS=wUQVxUKaguNodlGejJu8w4LpciE-,"Influencer Selling Hamptons Estate, Moving to Miami After Husband’s Suicide",6 months ago ·,The Daily Beast·  via Yahoo News
Tata bankruptcy,yahoo,https://r.search.yahoo.com/_ylt=AwrjIcR8y6BnARUmEDPQtDMD;_ylu=Y29sbwNncTEEcG9zAzgEdnRpZAMEc2VjA3Ny/RV=2/RE=1738619900/RO=10/RU=https%3a%2f%2fwww.yahoo.com%2flifestyle%2fyoure-youre-family-neighborhood-beauty-180000890.html%3ffr%3dsycsrp_catchall/RK=2/RS=ChWyOxtrIXQ8a4scaziK5dVkkac-,When You're Here You're Family: The New Neighborhood Beauty Shops,1 year ago ·,Town & Country·  via Yahoo News
Tata bankruptcy,yahoo,https://r.search.yahoo.com/_ylt=AwrjIcR8y6BnARUmEjPQtDMD;_ylu=Y29sbwNncTEEcG9zAzkEdnRpZAMEc2VjA3Ny/RV=2/RE=1738619900/RO=10/RU=https%3a%2f%2fnews.yahoo.com%2findia-now-most-populous-country-015347798.html%3ffr%3dsycsrp_catchall/RK=2/RS=otsYmtAzSRpGbSutrXt.rdVDzSw-,India is now the most populous country in the world. And it’s ready to become a...,2 years ago ·,CNN·  via Yahoo News
