Search String,Search Engine,Link,Title,Time stamp,Media name
Apple Lawsuits,yahoo,https://r.search.yahoo.com/_ylt=AwrO6PuEy6BnwKYkRLXQtDMD;_ylu=Y29sbwNncTEEcG9zAzMEdnRpZAMEc2VjA3Ny/RV=2/RE=1738619908/RO=10/RU=https%3a%2f%2fwww.androidheadlines.com%2f2025%2f02%2fapple-defends-search-engine-deals-in-google-antitrust-case.html/RK=2/RS=YIufLFW677OzJOBQfI_.fcOy1nU-,Apple defends search engine deals in Google's antitrust case,2 hours ago ·,Android Headlines
Apple Lawsuits,yahoo,https://r.search.yahoo.com/_ylt=AwrO6PuEy6BnwKYkRrXQtDMD;_ylu=Y29sbwNncTEEcG9zAzQEdnRpZAMEc2VjA3Ny/RV=2/RE=1738619908/RO=10/RU=https%3a%2f%2flifehacker.com%2ftech%2fapple-watch-settlement-how-to-claim/RK=2/RS=E4pALvQO4UWH0VjB0MhNPsfOKIQ-,How to Claim Your Piece of Apple's $20 Million Watch Settlement,3 days ago ·,Lifehacker
Apple Lawsuits,yahoo,https://r.search.yahoo.com/_ylt=AwrO6PuEy6BnwKYkSLXQtDMD;_ylu=Y29sbwNncTEEcG9zAzUEdnRpZAMEc2VjA3Ny/RV=2/RE=1738619908/RO=10/RU=https%3a%2f%2ffinance.yahoo.com%2fnews%2fapple-siri-settlement-could-paid-170101404.html%3ffr%3dsycsrp_catchall/RK=2/RS=V69ydWrRJnP50Upm5W3liMNFzn4-,Apple’s Siri Settlement: How You Could Get Paid — What You Need To Know,7 days ago ·,GOBankingRates·  via Yahoo Finance
Apple Lawsuits,yahoo,https://r.search.yahoo.com/_ylt=AwrO6PuEy6BnwKYkSrXQtDMD;_ylu=Y29sbwNncTEEcG9zAzYEdnRpZAMEc2VjA3Ny/RV=2/RE=1738619908/RO=10/RU=https%3a%2f%2ffinance.yahoo.com%2fnews%2fapple-reaches-20m-settlement-watch-202009039.html%3ffr%3dsycsrp_catchall/RK=2/RS=X07iA4Z_TnSpRFwd21WZdiKODw0-,Apple Will Pay Out $20 Million to Apple Watch Owners. Who Can File a Claim?,2 days ago ·,CNET·  via Yahoo Finance
Apple Lawsuits,yahoo,https://r.search.yahoo.com/_ylt=AwrO6PuEy6BnwKYkTLXQtDMD;_ylu=Y29sbwNncTEEcG9zAzcEdnRpZAMEc2VjA3Ny/RV=2/RE=1738619908/RO=10/RU=https%3a%2f%2fwww.yahoo.com%2ftech%2fnow-claim-part-20-million-061830111.html/RK=2/RS=oiBXiLoX3t81h0DweSBMBBNg8u4-,You Can Now Claim Part of This $20 Million Apple Watch Settlement,1 day ago ·,PC Mag·  via Yahoo News
Apple Lawsuits,yahoo,https://r.search.yahoo.com/_ylt=AwrO6PuEy6BnwKYkTrXQtDMD;_ylu=Y29sbwNncTEEcG9zAzgEdnRpZAMEc2VjA3Ny/RV=2/RE=1738619908/RO=10/RU=https%3a%2f%2ffinance.yahoo.com%2fnews%2fapple-paying-20-million-over-160106014.html%3ffr%3dsycsrp_catchall/RK=2/RS=Nu7Q4yiLow8BBsLcg2yK57bG2GU-,Apple paying $20 million over Apple Watch lawsuit — see if you’re eligible,2 days ago ·,Tom's Guide·  via Yahoo Finance
Apple Lawsuits,yahoo,https://r.search.yahoo.com/_ylt=AwrO6PuEy6BnwKYkULXQtDMD;_ylu=Y29sbwNncTEEcG9zAzkEdnRpZAMEc2VjA3Ny/RV=2/RE=1738619908/RO=10/RU=https%3a%2f%2fwww.macobserver.com%2fapple-watch%2f4-best-nontoxic-apple-watch-bands-for-your-skin-pfas-free%2f/RK=2/RS=lrsQeLZEZqpjaFYpQJ5ECkzQgR8-,4 Best Nontoxic Apple Watch Bands for Your Skin (PFAS Free),6 days ago ·,The Mac Observer
Apple Lawsuits,yahoo,https://r.search.yahoo.com/_ylt=AwrO6PuEy6BnwKYkUrXQtDMD;_ylu=Y29sbwNncTEEcG9zAzEwBHZ0aWQDBHNlYwNzcg--/RV=2/RE=1738619908/RO=10/RU=https%3a%2f%2fwww.phonearena.com%2fnews%2fsome-apple-watch-owners-will-share-20-million-dollar-class-action-settlement_id167114/RK=2/RS=xtochB8TDgTyIqekse0cTrn7Jeo-,Some Apple Watch owners will share $20 million paid by Apple to settle lawsuit,5 days ago ·,PhoneArena
Apple merger,google,https://www.investopedia.com/investing/top-companies-owned-apple/,6 Companies Owned by Apple,8 Oct 2024,Investopedia
Apple merger,google,https://timesofindia.indiatimes.com/technology/tech-news/apple-planning-to-buy-intel-what-and-why-of-rumours-of-apple-acquiring-the-56-year-old-chipmaker/articleshow/114861241.cms,Apple planning to buy Intel: What and why of rumours of Apple acquiring the 56-year-old chipmaker,2 Nov 2024,Times of India
Apple merger,google,https://www.indiatvnews.com/technology/news/could-apple-be-eyeing-intel-for-acquisition-2024-11-02-959899,Could Apple be eyeing Intel for acquisition?,2 Nov 2024,India TV News
Apple merger,google,https://m.economictimes.com/tech/technology/is-apple-buying-intel-rumours-of-a-deal-crop-up/articleshow/114873054.cms,Is Apple buying Intel? Rumours of a deal crop up,2 Nov 2024,The Economic Times
Apple merger,google,https://www.windowscentral.com/hardware/cpu-gpu-components/intel-could-potentially-be-on-apples-acquisition-portfolio-amid-financial-struggles-emancipating-itself-from-an-overreliance-on-tsmc-for-chips-but-samsung-could-have-better-standing,"Intel could potentially be on Apple's acquisition portfolio amid financial struggles, emancipating itself from an overreliance on TSMC for chips — but Samsung could have better standing",30 Oct 2024,Windows Central
Apple merger,google,https://www.livemint.com/companies/news/apple-set-for-music-tv-streaming-fight-in-india-after-airtel-deal-videos-market-share-revenue-customers-wynk-music-app-11725252005118.html,"Apple set for music, TV streaming fight in India after Airtel deal",2 Sept 2024,mint
Apple merger,google,https://www.musicbusinessworldwide.com/india-music-streaming-service-wynk-music-apple-music-via-new-airtel-partnership/,Indian streaming service Wynk Music to shut down; subscribers pushed to Apple Music via new Airtel partnership,27 Aug 2024,Music Business Worldwide
Apple merger,google,https://www.newsx.com/tech-and-auto/google-plans-to-merge-chrome-os-into-android-to-take-on-apples-ipad/,Google Plans To Merge Chrome OS Into Android To Take On Apple’s iPad,20 Nov 2024,Newsx
Apple merger,google,https://www.pocket-lint.com/apples-most-notable-acquisitions/,11 of Apple's most notable acquisitions,21 Jul 2024,Pocket-lint
Apple merger,google,https://www.business-standard.com/companies/news/tata-group-drops-plan-to-acquire-stake-in-vivo-india-over-apple-s-objection-124073100380_1.html,Tata Group drops plan to acquire stake in Vivo India over Apple's objection,31 Jul 2024,Business Standard
Apple merger,bing,https://www.business-standard.com/companies/news/apple-india-expansion-new-stores-iphone-sales-ai-launch-125013100535_1.html,"Apple chief Tim Cook reaffirms commitment to India, announcing four new stores and a major push for Apple Intelligence in ...",3d,3d
Apple merger,bing,/news/search?q=site%3awww.autoblog.com&FORM=NWBCLM,"Most recently, the electric car manufacturer hired away Apple's ""Hacker Princess,"" Kristin Paget, but it's possible to look back as far as 2010 to see when Tesla hired the man who worked on the ...",10y,Autoblog10y
Apple merger,bing,https://www.msn.com/en-in/money/other/google-plans-to-merge-chrome-os-into-android-to-take-on-apple-s-ipad/ar-AA1umAiZ?ocid=BingNewsVerp,The consolidation aims to streamline Google's development resources while creating a more unified platform to challenge Apple's dominance ... limitations. The merger could benefit Android's ...,1mon,Hosted on MSN1mon
Apple merger,bing,/news/search?q=site%3awww.crn.com&FORM=NWBCLM,"He touched on the recently announced merger of CSC and HPE's Enterprise Services unit, Apple's problematic first quarter, the rise of the Internet of Things, the explosion of the security market ...",8y,CRN8y
Apple merger,bing,/news/search?q=site%3awww.autoblog.com&FORM=NWBCLM,"Samsung might be a big competitor, but an Apple merger with Tesla could be a real boon for both businesses. In a knot of rumor and speculation over the recent weeks, the possibility of Apple ...",9y,Autoblog9y
Apple merger,bing,/news/search?q=site%3awww.investopedia.com&FORM=NWBCLM,"U.S. stock futures are down as investors eye rising Treasury yields, Tesla and Nvidia shares are moving lower as tech stocks come under pressure, and Apple shares are declining as global iPhone sales ...",21d,21d
Apple merger,yahoo,https://r.search.yahoo.com/_ylt=AwrO6PuGy6Bn_2ck7MzQtDMD;_ylu=Y29sbwNncTEEcG9zAzEEdnRpZAMEc2VjA3Ny/RV=2/RE=1738619910/RO=10/RU=https%3a%2f%2ffinance.yahoo.com%2fnews%2ftrumps-antitrust-cops-just-signaled-that-big-us-mergers-wont-get-a-free-pass-153029456.html%3ffr%3dsycsrp_catchall/RK=2/RS=hiChBQcmEwKMFj6TFw0jWp89vls-,Trump's antitrust cops just signaled that big US mergers won't get a free pass,22 hours ago ·,Yahoo Finance
Apple merger,yahoo,https://r.search.yahoo.com/_ylt=AwrO6PuGy6Bn_2ck7szQtDMD;_ylu=Y29sbwNncTEEcG9zAzIEdnRpZAMEc2VjA3Ny/RV=2/RE=1738619910/RO=10/RU=https%3a%2f%2fwww.cnbc.com%2f2025%2f02%2f03%2fmondays-biggest-wall-street-calls-like-nvidia.html/RK=2/RS=4uqKmILkCzmxNwMzaaAJgPzQwiQ-,"Here are Monday's biggest analyst calls: Nvidia, Apple, Tesla, Roblox,...",37 minutes ago ·,CNBC
Apple merger,yahoo,https://r.search.yahoo.com/_ylt=AwrO6PuGy6Bn_2ck8MzQtDMD;_ylu=Y29sbwNncTEEcG9zAzMEdnRpZAMEc2VjA3Ny/RV=2/RE=1738619910/RO=10/RU=https%3a%2f%2fwww.neowin.net%2fnews%2fopenais-sam-altman-to-meet-with-samsungs-lee-jae-young-in-seoul-to-discuss-ai-and-chips%2f/RK=2/RS=eRg_DZAEhoDJmcHaObduBaD3S5Y-,OpenAI's Sam Altman to meet with Samsung's Lee Jae-Young in Seoul to discuss AI...,38 minutes ago ·,Neowin
Apple merger,yahoo,https://r.search.yahoo.com/_ylt=AwrO6PuGy6Bn_2ck8szQtDMD;_ylu=Y29sbwNncTEEcG9zAzQEdnRpZAMEc2VjA3Ny/RV=2/RE=1738619910/RO=10/RU=https%3a%2f%2ffinance.yahoo.com%2fnews%2fwhere-rigetti-computing-3-years-152300664.html%3ffr%3dsycsrp_catchall/RK=2/RS=D7gFPt9GvetQ4IXLTlSxnmsm7NY-,Where Will Rigetti Computing Be in 3 Years?,23 hours ago ·,Motley Fool·  via Yahoo Finance
Apple merger,yahoo,https://r.search.yahoo.com/_ylt=AwrO6PuGy6Bn_2ck9MzQtDMD;_ylu=Y29sbwNncTEEcG9zAzUEdnRpZAMEc2VjA3Ny/RV=2/RE=1738619910/RO=10/RU=https%3a%2f%2fwww.investing.com%2fnews%2fstock-market-news%2fbofa-sees-a-buying-opportunity-in-apple-ibm-shares-after-deepseek-selloff-3833777/RK=2/RS=Ng3eC1tDRCMgWvg1h.0LEQdCr6c-,"BofA sees a buying opportunity in Apple, IBM shares after DeepSeek selloff By...",6 days ago ·,Investing.com
Apple merger,yahoo,https://r.search.yahoo.com/_ylt=AwrO6PuGy6Bn_2ck9czQtDMD;_ylu=Y29sbwNncTEEcG9zAzYEdnRpZAMEc2VjA3Ny/RV=2/RE=1738619910/RO=10/RU=https%3a%2f%2fwww.etfdailynews.com%2f2025%2f01%2f28%2fbarnes-group-inc-announces-completion-of-acquisition-by-goat-holdco-llc%2f/RK=2/RS=fmJ66VVEQroGxM6_Z49.PryWkI0-,"Barnes Group Inc. Announces Completion of Acquisition by Goat Holdco, LLC",6 days ago ·,ETF DAILY NEWS
Apple merger,yahoo,https://r.search.yahoo.com/_ylt=AwrO6PuGy6Bn_2ck9szQtDMD;_ylu=Y29sbwNncTEEcG9zAzcEdnRpZAMEc2VjA3Ny/RV=2/RE=1738619910/RO=10/RU=https%3a%2f%2fsmb.andalusiastarnews.com%2farticle%2fRipcord-and-VASTEC-Merge-to-Scale-Advanced-AI-Powered-Robotic-Document-Digitization-and-Records-Management-Solutions%3fstoryId%3d6799e6a005b3ce0008ec9179/RK=2/RS=23gGR0plN57V4BnpaBcdin9SDN4-,Ripcord and VASTEC Merge to Scale Advanced AI-Powered Robotic Document...,5 days ago ·,The Andalusia Star-News
Apple merger,yahoo,https://r.search.yahoo.com/_ylt=AwrO6PuGy6Bn_2ck.MzQtDMD;_ylu=Y29sbwNncTEEcG9zAzgEdnRpZAMEc2VjA3Ny/RV=2/RE=1738619910/RO=10/RU=https%3a%2f%2ffinance.yahoo.com%2fnews%2fbarrenjoey-opens-hong-kong-office-235456861.html%3ffr%3dsycsrp_catchall/RK=2/RS=nFBwirouIFrWhdlE7yJSn7pe.Cg-,Barrenjoey Opens Hong Kong Office as Australian Firm Expands,13 hours ago ·,Bloomberg·  via Yahoo Finance
Apple merger,yahoo,https://r.search.yahoo.com/_ylt=AwrO6PuGy6Bn_2ck.szQtDMD;_ylu=Y29sbwNncTEEcG9zAzkEdnRpZAMEc2VjA3Ny/RV=2/RE=1738619910/RO=10/RU=https%3a%2f%2ffinance.yahoo.com%2fnews%2ftrump-commerce-secretary-pick-howard-162215173.html%3ffr%3dsycsrp_catchall/RK=2/RS=qPCqfJQWGi83cZCbU93axKC42YA-,"Trump’s commerce secretary pick Howard Lutnick, defends Tether",5 days ago ·,TheStreet·  via Yahoo Finance
Apple merger,yahoo,https://r.search.yahoo.com/_ylt=AwrO6PuGy6Bn_2ck_MzQtDMD;_ylu=Y29sbwNncTEEcG9zAzEwBHZ0aWQDBHNlYwNzcg--/RV=2/RE=1738619910/RO=10/RU=https%3a%2f%2ffinance.yahoo.com%2fnews%2frtx-rtx-q4-2024-earnings-164513033.html%3ffr%3dsycsrp_catchall/RK=2/RS=lmLpkOxQ1JsoJrjCGriQ5WL4a8s-,RTX (RTX) Q4 2024 Earnings Call Transcript,6 days ago ·,Motley Fool·  via Yahoo Finance
Apple bankruptcy,google,https://yourstory.com/2024/09/steve-jobs-apple-comeback-strategy-tech-giant-success,"From 90 Days to Bankruptcy to a 9,000% Growth: How Steve Jobs Rescued Apple",11 Sept 2024,YourStory.com
Apple bankruptcy,google,https://www.digit.in/news/general/openai-is-heading-towards-bankruptcy-unless-apple-and-nvidia-come-to-its-rescue.html,OpenAI is heading towards bankruptcy unless Apple and Nvidia come to its rescue,17 Sept 2024,Digit
Apple bankruptcy,google,https://m.economictimes.com/magazines/panache/why-tim-cook-joined-a-nearly-bankrupt-apple-and-one-thing-steve-jobs-did-differently/articleshow/114488999.cms,Why Tim Cook joined a nearly bankrupt Apple and one thing Steve Jobs did differently,23 Oct 2024,The Economic Times
Apple bankruptcy,google,https://www.xda-developers.com/27-years-ago-microsoft-bought-150-million-worth-of-apple-stock-after-the-company-almost-went-bankrupt/,"27 years ago, Microsoft bought $150 million worth of Apple stock after the company almost went bankrupt",6 Aug 2024,XDA
Apple bankruptcy,google,https://www.moneycontrol.com/news/business/markets/world-street-buffetts-10-billion-bofa-sale-brent-tops-80-ftx-bankruptcy-plan-cleared-and-more-12837608.html,"World Street | Buffett’s $10 billion BofA sale, Brent tops $80, FTX bankruptcy plan cleared, and more",8 Oct 2024,Moneycontrol
Apple bankruptcy,google,https://www.windowscentral.com/software-apps/openais-bankruptcy-flames-linger-on-as-apple-wiggles-out-of-its-latest-dollar65-billion-funding-round-at-the-eleventh-hour-leaving-the-mantle-to-microsoft-and-nvidia,OpenAI's bankruptcy flames linger on as Apple wiggles out of its latest $6.5 billion funding round at the eleventh hour — leaving the mantle to Microsoft and NVIDIA,1 Oct 2024,Windows Central
Apple bankruptcy,google,https://www.benzinga.com/personal-finance/24/10/41340693/bill-gates-saved-rival-apple-from-bankruptcy-by-investing-150-million-steve-jobs-thanked-him-pub,Bill Gates Saved 'Rival' Apple From Bankruptcy By Investing $150 Million – Steve Jobs Thanked Him Publicly: 'The World's A Better Place',15 Oct 2024,Benzinga
Apple bankruptcy,google,https://www.businesstoday.in/technology/news/story/that-will-bankrupt-even-bill-gates-tesla-ceo-elon-musk-sounds-alarm-bells-as-he-crosses-400-billion-wealth-mark-457244-2024-12-13,‘That will bankrupt even Bill Gates’: Tesla CEO Elon Musk sounds alarm bells as he crosses $400 billion wealth mark,1 month ago,Business Today
Apple bankruptcy,google,https://www.thestreet.com/apple/news/apple-in-the-1990s-why-it-nearly-went-bankrupt,Apple In The 1990s: Why It Nearly Went Bankrupt,10 Feb 2023,TheStreet
Apple bankruptcy,google,https://www.pcmag.com/news/ev-upstart-canoo-declares-bankruptcy,EV Start-Up Canoo Declares Bankruptcy,2 weeks ago,PCMag
Apple bankruptcy,bing,https://www.msn.com/en-in/money/news/apple-s-journey-from-bankruptcy-to-a-trillion-dollar-brand-and-beyond/ar-AA1qKTaz?ocid=BingNewsVerp,Apple 's journey hasn't been all rosy. It has toyed with the idea of bankruptcy and faced sluggish device demands in markets across the globe. What has helped it face these headwinds is its strong ...,4mon,Hosted on MSN4mon
Apple bankruptcy,bing,/news/search?q=site%3awww.moneycontrol.com&FORM=NWBCLM,It lasted 14 hours but the TikTok ban got Apple and Google swiftly into action. The TikTok app in the US was removed from Google Play Store and Apple App Store as soon as it went dark. While TikTok ...,14d,14d
Apple bankruptcy,bing,https://www.msn.com/en-us/money/other/bill-gates-saved-rival-apple-from-bankruptcy-by-investing-150-million-steve-jobs-thanked-him-publicly-the-world-s-a-better-place/ar-AA1sjNvA?ocid=BingNewsVerp,"In August 1997, Apple was on the edge of collapse. Its finances were in shambles and the tech giant that once stood at the forefront of innovation was nearing bankruptcy. Enter Bill Gates ...",3mon,Hosted on MSN3mon
Apple bankruptcy,bing,https://techcrunch.com/2025/01/17/ev-startup-canoo-files-for-bankruptcy-and-ceases-operations/,"Seven-year-old electric vehicle startup Canoo has filed for bankruptcy and will ""cease operations immediately."" The company ...",16d,16d
Apple bankruptcy,yahoo,https://r.search.yahoo.com/_ylt=AwrO6PuIy6BnMXolyGXQtDMD;_ylu=Y29sbwNncTEEcG9zAzEEdnRpZAMEc2VjA3Ny/RV=2/RE=1738619912/RO=10/RU=https%3a%2f%2fwww.yahoo.com%2fnews%2farchdiocese-orleans-second-harvest-talk-021713398.html%3ffr%3dsycsrp_catchall/RK=2/RS=WF..kbCUjl0cAIM8VencLJPff5g-,Archdiocese of New Orleans and Second Harvest talk leadership change,2 days ago ·,WGNO·  via Yahoo News
Apple bankruptcy,yahoo,https://r.search.yahoo.com/_ylt=AwrO6PuIy6BnMXolymXQtDMD;_ylu=Y29sbwNncTEEcG9zAzIEdnRpZAMEc2VjA3Ny/RV=2/RE=1738619912/RO=10/RU=https%3a%2f%2fwww.yahoo.com%2flifestyle%2fbest-exercise-bikes-2025-094200485.html%3ffr%3dsycsrp_catchall/RK=2/RS=19riH4Mavqjdu6VoYyAvG5lKXyc-,Best Exercise Bikes for 2025,4 hours ago ·,CNET·  via Yahoo News
Apple bankruptcy,yahoo,https://r.search.yahoo.com/_ylt=AwrO6PuIy6BnMXolzGXQtDMD;_ylu=Y29sbwNncTEEcG9zAzMEdnRpZAMEc2VjA3Ny/RV=2/RE=1738619912/RO=10/RU=https%3a%2f%2fwww.benzinga.com%2fmarkets%2fequities%2f25%2f01%2f43296517%2fblack-swan-author-nassim-taleb-nvidias-17-drop-on-monday-is-just-the-beginning-says-electric-cars-are-next-noting-pioneers-with-innovative-ideas-never-made-money/RK=2/RS=Q.b7M5VgKBJaKKL6pRUxvZtIoA8-,...Stock's 17% Drop On Monday Is 'Just The Beginning' Of Market Rout - Apple...,5 days ago ·,Benzinga
Apple bankruptcy,yahoo,https://r.search.yahoo.com/_ylt=AwrO6PuIy6BnMXolzmXQtDMD;_ylu=Y29sbwNncTEEcG9zAzQEdnRpZAMEc2VjA3Ny/RV=2/RE=1738619912/RO=10/RU=https%3a%2f%2fwww.phonearena.com%2fnews%2fiphone-16-sales-analysis-storage-upgrades-big-problem-for-apple_id167134/RK=2/RS=vAHWFVg.dxcPR0gS9oMvDFpdmUs-,New iPhone 16 sales analysis reveals an unusual new problem Apple is facing all...,4 days ago ·,PhoneArena
Apple bankruptcy,yahoo,https://r.search.yahoo.com/_ylt=AwrO6PuIy6BnMXol0GXQtDMD;_ylu=Y29sbwNncTEEcG9zAzUEdnRpZAMEc2VjA3Ny/RV=2/RE=1738619912/RO=10/RU=https%3a%2f%2fbuffalonews.com%2fnews%2flocal%2fbuffalo-diocese-bankruptcy-long-island-diocese-abuse-claimants%2farticle_b6b37d76-df4e-11ef-ba75-676ce956a5b9.html/RK=2/RS=YUkIffJ56ttg1smx2ittZo4F1Sg-,Long Island diocese's exit from bankruptcy may signal future path for Buffalo...,2 days ago ·,The Buffalo News
Apple bankruptcy,yahoo,https://r.search.yahoo.com/_ylt=AwrO6PuIy6BnMXol0WXQtDMD;_ylu=Y29sbwNncTEEcG9zAzYEdnRpZAMEc2VjA3Ny/RV=2/RE=1738619912/RO=10/RU=https%3a%2f%2fwww.axios.com%2f2025%2f02%2f03%2fbill-gates-interview-steve-jobs-rivalry/RK=2/RS=gdrNbn7SZ64yhUPAtLPHAiv8IgU-,Bill Gates recounts rivalry with Steve Jobs,4 hours ago ·,Axios
Apple bankruptcy,yahoo,https://r.search.yahoo.com/_ylt=AwrO6PuIy6BnMXol02XQtDMD;_ylu=Y29sbwNncTEEcG9zAzcEdnRpZAMEc2VjA3Ny/RV=2/RE=1738619912/RO=10/RU=https%3a%2f%2fdecider.com%2f2025%2f01%2f27%2fthe-white-lotus-season-3-trailer-easter-eggs-cast-guide%2f/RK=2/RS=ypfqsi7I_5ITlS50tA27cgXv.mM-,"New 'The White Lotus' trailer reveals tantalizing clues for Season 3: Murder,...",7 days ago ·,Decider
Apple bankruptcy,yahoo,https://r.search.yahoo.com/_ylt=AwrO6PuIy6BnMXol1WXQtDMD;_ylu=Y29sbwNncTEEcG9zAzgEdnRpZAMEc2VjA3Ny/RV=2/RE=1738619912/RO=10/RU=https%3a%2f%2fwww.si.com%2fmlb%2frangers%2fnews%2ftexas-rangers-announce-regional-tv-options-for-cable-satellite-over-the-air/RK=2/RS=MBaYJ4oW.0OFnRpZtNZLO2lTfr4-,"Texas Rangers Announce Regional TV Options for Cable, Satellite, Over-the-Air",6 days ago ·,Sports Illustrated
Apple bankruptcy,yahoo,https://r.search.yahoo.com/_ylt=AwrO6PuIy6BnMXol1mXQtDMD;_ylu=Y29sbwNncTEEcG9zAzkEdnRpZAMEc2VjA3Ny/RV=2/RE=1738619912/RO=10/RU=https%3a%2f%2fwww.tmj4.com%2fabout-us%2flighthouse%2fresidents-outraged-to-learn-hacm-is-at-risk-of-bankruptcy-after-misuse-of-section-8-funding/RK=2/RS=RcSKCJNf06JheCXQhsdastUufqg-,Residents outraged to learn HACM is at risk of bankruptcy after misuse of...,3 days ago ·,TMJ4 Milwaukee
Apple bankruptcy,yahoo,https://r.search.yahoo.com/_ylt=AwrO6PuIy6BnMXol12XQtDMD;_ylu=Y29sbwNncTEEcG9zAzEwBHZ0aWQDBHNlYwNzcg--/RV=2/RE=1738619912/RO=10/RU=https%3a%2f%2fwgno.com%2fnews%2flouisiana%2forleans-parish%2finterim-ceo-appointed-to-second-harvest-food-bank%2f/RK=2/RS=QRcSIvRzqEufP2Va4F74BRI.VkQ-,Interim CEO appointed to Second Harvest Food Bank,4 days ago ·,ABC 26 New Orleans
